{"$schema":"https://json-schema.org/draft/2020-12/schema","type":"object","required":["counter_audit_id","title","original_audit_id","challenge_types","scope","evidence_refs","conflicts_of_interest","timestamp","status"],"properties":{"counter_audit_id":{"type":"string","pattern":"^CAUD-[A-Z0-9-]+$"},"title":{"type":"string"},"original_audit_id":{"type":"string"},"challenge_types":{"type":"array","minItems":1},"scope":{"type":"string"},"evidence_refs":{"type":"array"},"conflicts_of_interest":{"type":"object","required":["declared"]},"timestamp":{"type":"string","format":"date-time"},"status":{"enum":["draft","completed","example_not_actual"]}},"additionalProperties":false}
