{"counter_audit_id":"CAUD-EXAMPLE-0001","title":"EXAMPLE — NOT AN ACTUAL COUNTER-AUDIT","original_audit_id":"AUD-EXAMPLE-0001","challenge_types":["findings","evidence","methodology","scope","conflict_of_interest","procedural_compliance"],"scope":"Schema illustration only.","evidence_refs":[],"conflicts_of_interest":{"declared":false},"timestamp":"2026-10-02T00:00:00Z","status":"example_not_actual"}
